id,title,year,cited_by_count,cdIndex,ns,np,concepts_names
https://openalex.org/W3109143648,Changing Expectations? The Change in the Role of the Welfare Ministry in the Regulation of Personal Social Services,2020,1,-1.0,0,1,"Outsourcing, Christian ministry, Welfare, Social Welfare, Welfare state, Government (linguistics), Public administration, Variety (cybernetics), State (computer science), Public economics, Political science, Business, Economics, Law, Politics, Philosophy, Linguistics, Algorithm, Artificial intelligence, Computer science"
https://openalex.org/W3022811260,"The Mother-Based Intervention: Policy, Social Work, and the Absence of Fathers in the Social Services in Israel",2020,1,-1.0,0,1,"Psychological intervention, Intervention (counseling), Social policy, Social work, Work (physics), Social Welfare, Psychology, Sociology, Political science, Economic growth, Economics, Engineering, Psychiatry, Mechanical engineering, Law"
https://openalex.org/W4200172867,Radical Hope,2020,1,1.0,1,0,"Social work, Solidarity, Poverty, Sociology, Transformational leadership, Public relations, Political science, Critical practice, Social order, Social Welfare, Social science, Law, Politics"
https://openalex.org/W3011171776,Austerity Beyond Crisis: Economists and the Institution of Austere Social Spending for At-Risk Children in Israel,2020,1,1.0,1,0,"Austerity, Economics, Social policy, Social Welfare, Political economy, Welfare state, Political science, Economic policy, Development economics, Politics, Market economy, Law"
https://openalex.org/W3192546151,At the Intersection of Health Care and Human Rights: Violations of Medical Neutrality and The Emergence of Medical Resistance,2020,1,1.0,1,0,"Neutrality, Human rights, Resistance (ecology), Law, Health care, Political science, State (computer science), Politics, Sociology, Ecology, Algorithm, Computer science, Biology"
https://openalex.org/W3034855627,Making the Indebted Citizen: An Inquiry into State Benevolence in Turkey,2020,1,1.0,1,0,"State (computer science), Welfare state, Political science, Obedience, Bureaucracy, Power (physics), Political economy, Politics, Debt, Shadow (psychology), Turkish, Welfare, Sociology, Public administration, Law, Economics, Psychology, Finance, Algorithm, Linguistics, Philosophy, Physics, Quantum mechanics, Psychotherapist, Computer science"
https://openalex.org/W3110742833,"Neoliberalism, welfare, and mass male circumcisions in Turkey",2020,1,-1.0,0,1,"Neoliberalism (international relations), Welfare, Welfare state, Political economy, Sociology, Economic Justice, Social justice, State (computer science), Political science, Law, Politics, Algorithm, Computer science"
https://openalex.org/W3022023797,"Electoral Polarization, Class Politics and a New Welfare State in Brazil and Turkey",2020,2,-1.0,0,2,"Welfare state, Internationalization, Polarization (electrochemistry), State (computer science), Welfare, Politics, Political science, Middle class, Class (philosophy), Economic system, Political economy, Power (physics), Economics, Market economy, International trade, Law, Chemistry, Physics, Physical chemistry, Algorithm, Quantum mechanics, Artificial intelligence, Computer science"
https://openalex.org/W3045612253,The Politics of Welfare in Turkey,2020,1,1.0,1,0,"Proletariat, Welfare state, Politics, Neoliberalism (international relations), Political economy, Political science, Economic system, Economics, Law"
https://openalex.org/W3034339248,Women’s empowerment in the period of the rapid expansion of higher education in Turkey: developments and paradoxes of gender equality in the labour market,2020,1,1.0,1,0,"Higher education, Educational attainment, Empowerment, Gender equality, Demographic economics, Wage, Gender disparity, Labour economics, Gender pay gap, Inequality, Gender inequality, Gender discrimination, Economics, Human capital, Political science, Sociology, Economic growth, Gender studies, Mathematical analysis, Mathematics"
https://openalex.org/W3032638848,Does the coronavirus pandemic level the gender inequality curve? (It doesn’t),2020,1,1.0,1,0,"Pandemic, Coronavirus disease 2019 (COVID-19), Coronavirus, Inequality, Recession, Gender inequality, Severe acute respiratory syndrome coronavirus 2 (SARS-CoV-2), 2019-20 coronavirus outbreak, Economic inequality, Economics, Demographic economics, Development economics, Virology, Medicine, Macroeconomics, Mathematical analysis, Mathematics, Disease, Pathology, Outbreak, Infectious disease (medical specialty)"
https://openalex.org/W3092002788,Does COVID-19 change dietary habits and lifestyle behaviours in Kuwait: a community-based cross-sectional study,2020,3,-1.0,0,3,"Meal, Environmental health, Medicine, Pandemic, Coronavirus disease 2019 (COVID-19), Cross-sectional study, Outbreak, Demography, Public health, Gerontology, Food science, Disease, Biology, Infectious disease (medical specialty), Pathology, Virology, Sociology, Nursing"
https://openalex.org/W3084139336,COVID-19 clinical outcomes and nationality: results from a Nationwide registry in Kuwait,2020,2,-1.0,0,2,"Medicine, ARDS, Intensive care unit, Logistic regression, Pandemic, Odds, Public health, Coronavirus disease 2019 (COVID-19), Emergency medicine, Population, Odds ratio, Epidemiology, Health care, Demography, Environmental health, Intensive care medicine, Internal medicine, Disease, Infectious disease (medical specialty), Lung, Nursing, Sociology, Economics, Economic growth"
https://openalex.org/W3040703007,COVID-19 stressors on migrant workers in Kuwait: cumulative risk considerations,2020,4,-0.5,1,3,"Stressor, Pandemic, Psychological intervention, Business, Public health, Coronavirus disease 2019 (COVID-19), Migrant workers, Intervention (counseling), Environmental health, Economic growth, Psychology, Medicine, Nursing, Economics, Clinical psychology, Disease, Pathology, Infectious disease (medical specialty)"
https://openalex.org/W3047233789,Poor eating habits and predictors of weight gain during the COVID-19 quarantine measures in Kuwait: a cross sectional study,2020,1,-1.0,0,1,"Snowball sampling, Anxiety, Medicine, Coronavirus disease 2019 (COVID-19), Public health, Feeling, Environmental health, Demography, Psychology, Psychiatry, Social psychology, Internal medicine, Disease, Nursing, Pathology, Sociology, Infectious disease (medical specialty)"
https://openalex.org/W3100131610,Prevalence of smoking in the Kuwaiti adult population in 2014: a cross-sectional study,2020,1,-1.0,0,1,"Medicine, Cross-sectional study, Confidence interval, Environmental health, Demography, Population, Secondhand smoke, Passive smoking, Public health, Internal medicine, Nursing, Pathology, Sociology"
https://openalex.org/W3021234551,The impact of strict public health measures on COVID-19 transmission in developing countries: The case of Kuwait,2020,1,1.0,1,0,"Outbreak, Psychological intervention, Public health, Public health interventions, Developing country, Health care, Environmental health, Basic reproduction number, Transmission (telecommunications), Population, Control (management), Observational study, Coronavirus disease 2019 (COVID-19), Medicine, Economic growth, Economics, Disease, Computer science, Infectious disease (medical specialty), Virology, Nursing, Telecommunications, Management, Pathology"
https://openalex.org/W3081805385,Patterns of suicide in Kuwait from 2014 to 2018,2020,1,-1.0,0,1,"Death toll, Demography, Public health, Suicide prevention, Population, Government (linguistics), Medicine, Poison control, Environmental health, Geography, Sociology, Linguistics, Philosophy, Nursing"
https://openalex.org/W3040762986,Health systems efficiency in Eastern Mediterranean Region: a data envelopment analysis,2020,1,1.0,1,0,"Life expectancy, Data envelopment analysis, Public health, Health care, Inefficiency, Developing country, Middle East, Gross domestic product, Health administration, Environmental health, Medicine, Economic growth, Population, Economics, Geography, Statistics, Mathematics, Nursing, Archaeology, Microeconomics"
https://openalex.org/W3011804670,Cancer incidence attributable to tobacco smoking in GCC countries in 2018,2020,2,1.0,2,0,"Medicine, Lung cancer, Cancer, Attributable risk, Environmental health, Population, Demography, Cancer registry, Incidence (geometry), Tobacco control, Cervical cancer, Colorectal cancer, Public health, Oncology, Internal medicine, Pathology, Physics, Sociology, Optics"
https://openalex.org/W3047898105,Impact of COVID-19 pandemic on mental health in the general population: A systematic review,2020,10,-0.4,3,7,"Mental health, Pandemic, Population, Anxiety, Medicine, Psychiatry, Scopus, Public health, MEDLINE, Depression (economics), Psychology, Disease, Coronavirus disease 2019 (COVID-19), Environmental health, Nursing, Pathology, Infectious disease (medical specialty), Law, Economics, Macroeconomics, Political science"
https://openalex.org/W3022270830,Adaptation of the Fear of COVID-19 Scale: Its Association with Psychological Distress and Life Satisfaction in Turkey,2020,4,-0.5,1,3,"Psychology, Life satisfaction, Turkish, Clinical psychology, Scale (ratio), Distress, Confirmatory factor analysis, Cronbach's alpha, Health psychology, Convergent validity, Mental health, Validity, Public health, Psychometrics, Psychiatry, Social psychology, Structural equation modeling, Medicine, Linguistics, Philosophy, Physics, Statistics, Mathematics, Nursing, Quantum mechanics, Internal consistency"
https://openalex.org/W3033373145,The psychological and mental impact of coronavirus disease 2019 (COVID-19) on medical staff and general public – A systematic review and meta-analysis,2020,1,-1.0,0,1,"Meta-analysis, Medicine, Anxiety, Mental health, Public health, Psychological intervention, Pandemic, Depression (economics), Population, Socioeconomic status, Isolation (microbiology), Confidence interval, Social isolation, Psychiatry, Disease, Environmental health, Family medicine, Coronavirus disease 2019 (COVID-19), Nursing, Infectious disease (medical specialty), Internal medicine, Biology, Microbiology, Economics, Macroeconomics"
https://openalex.org/W3092934210,COVID-19 vaccine hesitancy is associated with beliefs on the origin of the novel coronavirus in the UK and Turkey,2020,7,0.1428571428571428,4,3,"Coronavirus disease 2019 (COVID-19), Vaccination, Odds, Coronavirus, Pandemic, Anxiety, Government (linguistics), Public health, Severe acute respiratory syndrome coronavirus 2 (SARS-CoV-2), 2019-20 coronavirus outbreak, Family medicine, Psychology, Virology, Medicine, Demography, Disease, Sociology, Infectious disease (medical specialty), Outbreak, Logistic regression, Psychiatry, Nursing, Linguistics, Philosophy, Pathology, Internal medicine"
https://openalex.org/W3033332187,"Coronavirus Stress, Optimism-Pessimism, Psychological Inflexibility, and Psychological Health: Psychometric Properties of the Coronavirus Stress Measure",2020,2,-1.0,0,2,"Optimism, Pessimism, Psychology, Health psychology, Psychological intervention, Mental health, Clinical psychology, Coronavirus, Public health, Coronavirus disease 2019 (COVID-19), Social psychology, Psychiatry, Medicine, Philosophy, Nursing, Disease, Epistemology, Pathology, Infectious disease (medical specialty)"
https://openalex.org/W3104583802,"Fear of COVID-19, Mindfulness, Humor, and Hopelessness: A Multiple Mediation Analysis",2020,1,-1.0,0,1,"Psychology, Mindfulness, Beck Hopelessness Scale, Clinical psychology, Health psychology, Structural equation modeling, Coping (psychology), Context (archaeology), Coronavirus disease 2019 (COVID-19), Mediation, Anxiety, Psychiatry, Public health, Beck Depression Inventory, Disease, Medicine, Paleontology, Statistics, Nursing, Political science, Infectious disease (medical specialty), Law, Biology, Mathematics, Pathology"
https://openalex.org/W3016771373,"COVID-19 outbreak control, example of ministry of health of Turkey",2020,5,1.0,5,0,"Pandemic, Medicine, Preparedness, Public health, Guideline, Isolation (microbiology), Outbreak, Christian ministry, Personal protective equipment, Work (physics), Medical emergency, Environmental health, Infection control, Coronavirus disease 2019 (COVID-19), Disease, Infectious disease (medical specialty), Nursing, Political science, Virology, Pathology, Law, Mechanical engineering, Microbiology, Biology, Engineering"
https://openalex.org/W3048529266,"Prevalence and predictors of common mental disorders among Syrian refugees in Istanbul, Turkey: a cross-sectional study",2020,1,-1.0,0,1,"Mental health, Refugee, Psychiatry, Anxiety, Depression (economics), Cross-sectional study, Medicine, Public health, Checklist, Comorbidity, Stressor, Clinical psychology, Psychology, Nursing, Archaeology, Pathology, History, Economics, Cognitive psychology, Macroeconomics"
https://openalex.org/W3005770889,The household economic burden of non-communicable diseases in 18 countries,2020,1,-1.0,0,1,"Environmental health, Tanzania, Medicine, China, Disease burden, Non-communicable disease, Developing country, Public health, Socioeconomics, Economic growth, Geography, Population, Economics, Nursing, Archaeology"
https://openalex.org/W3112259453,"Bovine Babesiosis in Turkey: Impact, Current Gaps, and Opportunities for Intervention",2020,1,-1.0,0,1,"Babesiosis, Babesia bovis, Rhipicephalus, Babesia, Acaricide, Rhipicephalus microplus, Tick, Veterinary medicine, Biology, Public health, Environmental health, Livestock, Babesia bigemina, Population, Tick-borne disease, Medicine, Ecology, Nursing"
https://openalex.org/W3094575270,Adoption rates of electronic health records in Turkish Hospitals and the relation with hospital sizes,2020,1,-1.0,0,1,"Health informatics, Health administration, Medicine, Turkish, Health care, Nursing research, Quality (philosophy), Electronic health record, Family medicine, Public health, Medical emergency, Nursing, Linguistics, Philosophy, Epistemology, Economics, Economic growth"
https://openalex.org/W3048923397,Interference in scientific research on COVID-19 in Turkey,2020,1,1.0,1,0,"Turkish, Epidemiology, Pandemic, Medicine, China, Christian ministry, Coronavirus disease 2019 (COVID-19), Outbreak, Global health, Public health, Severe acute respiratory syndrome coronavirus 2 (SARS-CoV-2), Family medicine, Demography, Environmental health, Disease, Virology, Geography, Infectious disease (medical specialty), Political science, Internal medicine, Pathology, Philosophy, Linguistics, Archaeology, Sociology, Law"
https://openalex.org/W3094667068,Meaningful Living to Promote Complete Mental Health Among University Students in the Context of the COVID-19 Pandemic,2020,2,-1.0,0,2,"Mental health, Meaning (existential), Context (archaeology), Psychology, Pandemic, Health psychology, Psychopathology, Distress, Public health, Mental distress, Clinical psychology, Psychiatry, Coronavirus disease 2019 (COVID-19), Developmental psychology, Medicine, Psychotherapist, Nursing, Paleontology, Disease, Pathology, Infectious disease (medical specialty), Biology"
https://openalex.org/W3016398924,Case Fatality Rate estimation of COVID-19 for European Countries: Turkey’s Current Scenario Amidst a Global Pandemic; Comparison of Outbreakswith European Countries,2020,1,1.0,1,0,"Case fatality rate, Pandemic, Epidemiology, Outbreak, Demography, Geography, Coronavirus disease 2019 (COVID-19), Estimation, Public health, China, Socioeconomics, Medicine, Virology, Disease, Infectious disease (medical specialty), Nursing, Management, Archaeology, Pathology, Sociology, Internal medicine, Economics"
https://openalex.org/W3099033334,"Impacts of COVID-19 pandemic period on depression, anxiety and stress levels of the healthcare employees in Turkey",2020,1,1.0,1,0,"Anxiety, Health care, Pandemic, Depression (economics), Psychology, Medicine, Mental health, Public health, Coronavirus disease 2019 (COVID-19), Psychiatry, Nursing, Political science, Disease, Infectious disease (medical specialty), Law, Economics, Macroeconomics, Pathology"
https://openalex.org/W3083288602,Vector-borne Zoonotic Diseases in Turkey: Rising Threats on Public Health,2020,1,-1.0,0,1,"Public health, Vector (molecular biology), Environmental health, Virology, Political science, Geography, Medicine, Biology, Pathology, Biochemistry, Gene, Recombinant DNA"
https://openalex.org/W3092835037,Sources of information in times of health crisis: evidence from Turkey during COVID-19,2020,1,1.0,1,0,"Newspaper, Journalism, Socioeconomic status, The Internet, Educational attainment, Turkish, Information source (mathematics), Psychology, Social media, Public health, Public opinion, Public relations, Political science, Advertising, Sociology, Medicine, Demography, Business, Population, Nursing, Linguistics, Philosophy, Statistics, Mathematics, Politics, World Wide Web, Computer science, Law"
https://openalex.org/W2999281811,VACCINE HESITANCY IN TURKEY,2020,1,1.0,1,0,"Medicine, Vaccination, Distrust, Population, Mandate, Public health, Pediatrics, Family medicine, Environmental health, Immunology, Law, Nursing, Political science"
https://openalex.org/W3100067644,International Comparison of Six Basic eHealth Indicators Across 14 Countries: An eHealth Benchmarking Study,2020,1,1.0,1,0,"eHealth, Benchmarking, Health care, Business, Medicine, Health informatics, Health information exchange, Nursing, Family medicine, Health information, Economic growth, Public health, Marketing, Economics"
https://openalex.org/W3038813747,Occupational class and educational level inequalities in major cardiovascular risk factors in Turkey: 2008–2016,2020,1,-1.0,0,1,"Overweight, Inequality, Medicine, Obesity, Environmental health, Turkish, Demography, Public health, Body mass index, Population, Mathematical analysis, Linguistics, Philosophy, Mathematics, Nursing, Pathology, Sociology, Internal medicine"
https://openalex.org/W3043998225,"Public awareness, knowledge and sensitivity towards celiac disease and gluten-free diet is insufficient: a survey from Turkey",2020,1,-1.0,0,1,"Disease, Gluten free, Medicine, Demographics, Public health, Environmental health, Internal medicine, Family medicine, Demography, Nursing, Sociology"
https://openalex.org/W2942610717,Suicidal Behavior in the Mediterranean Countries,2020,1,-1.0,0,1,"Suicidal ideation, Demography, Mediterranean climate, Suicide prevention, Public health, Poison control, Injury prevention, Descriptive statistics, Medicine, Geography, Occupational safety and health, Palestine, Environmental health, Sociology, History, Statistics, Ancient history, Nursing, Archaeology, Mathematics, Pathology"
https://openalex.org/W3040788898,Unvaccinated children as community parasites in National Qualitative Study from Turkey,2020,1,1.0,1,0,"Medicine, Thematic analysis, Vaccination, Psychological intervention, Family medicine, Qualitative research, Focus group, Vaccination schedule, Health care, Biostatistics, Public health, Environmental health, Nursing, Immunology, Immunization, Economic growth, Social science, Business, Marketing, Sociology, Antigen, Economics"
https://openalex.org/W3035442900,The Global Alliance against Chronic Respiratory Diseases: journey so far and way ahead,2020,1,1.0,1,0,"Alliance, General assembly, Global health, Control (management), Medicine, Political science, Business, Management, Nursing, Law, Public health, Economics"
https://openalex.org/W3045156151,"The Impact of Health Belief Model Based Educational Intervention on Women’s Knowledge, Beliefs, Preventive Behaviors and Clinical Outcomes About Osteoporosis",2020,1,-1.0,0,1,"Medicine, Health belief model, Intervention (counseling), Osteoporosis, Physical therapy, Population, Vitamin D and neurology, Health education, Bone mineral, Gerontology, Public health, Internal medicine, Environmental health, Nursing"
https://openalex.org/W3035820996,"Personality Traits, Risk Perception, and Protective Behaviors of Arab Residents of Qatar During the COVID-19 Pandemic",2020,3,-0.3333333333333333,1,2,"Social distance, Pandemic, Hygiene, Psychology, Personal hygiene, Personality, Neuroticism, Personal protective equipment, Distancing, Health psychology, Social psychology, Public health, Big Five personality traits, Risk perception, Perception, Environmental health, Medicine, Coronavirus disease 2019 (COVID-19), Disease, Family medicine, Nursing, Infectious disease (medical specialty), Pathology, Neuroscience"
https://openalex.org/W3088980169,The impact of the COVID-19 pandemic on the perinatal mental health of women,2020,1,1.0,1,0,"Medicine, Anxiety, Mental health, Pandemic, Public health, Psychological intervention, Coping (psychology), Depression (economics), Psychiatry, Pregnancy, Patient Health Questionnaire, Cross-sectional study, Environmental health, Coronavirus disease 2019 (COVID-19), Disease, Depressive symptoms, Infectious disease (medical specialty), Nursing, Genetics, Pathology, Biology, Economics, Macroeconomics"
https://openalex.org/W3107469043,Analysis of Qatar's successful public health policy in dealing with the Covid-19 pandemic,2020,1,1.0,1,0,"Coronavirus disease 2019 (COVID-19), Pandemic, 2019-20 coronavirus outbreak, Severe acute respiratory syndrome coronavirus 2 (SARS-CoV-2), Public health, Political science, Virology, Medicine, Nursing, Infectious disease (medical specialty), Outbreak, Disease, Pathology"
https://openalex.org/W3087661615,Occupational Safety and Work-Related Injury Control Efforts in Qatar: Lessons Learned from a Rapidly Developing Economy,2020,1,-1.0,0,1,"Expatriate, Workforce, Occupational safety and health, Enforcement, Poison control, Public health, Business, Work (physics), Human factors and ergonomics, Suicide prevention, Public relations, Injury prevention, Control (management), Economic growth, Medicine, Environmental health, Political science, Nursing, Engineering, Economics, Law, Management, Mechanical engineering"
https://openalex.org/W3045633949,Willingness to participate in genome testing: a survey of public attitudes from Qatar,2020,1,1.0,1,0,"Genetic testing, Genetic counseling, Public health, Population, Genomics, Health care, Personal genomics, Medicine, Psychology, Genome, Environmental health, Genetics, Biology, Political science, Nursing, Gene, Law"
https://openalex.org/W3009072071,"Epidemiology of herpes zoster in the State of Qatar, 2012–2017",2020,1,-1.0,0,1,"Medicine, Epidemiology, Incidence (geometry), Christian ministry, Public health, Population, Pediatrics, Demography, Environmental health, Internal medicine, Pathology, Theology, Philosophy, Physics, Sociology, Optics"
https://openalex.org/W3048082311,"Investigating the incidence, nature, severity and potential causality of medication errors in hospital settings in Qatar",2020,1,-1.0,0,1,"Medicine, Incidence (geometry), Pharmacy, Causality (physics), Public health, Emergency medicine, Incident report, Causation, Medical emergency, Family medicine, Nursing, Computer security, Physics, Quantum mechanics, Computer science, Law, Political science, Optics"
https://openalex.org/W3036633570,Health system’s response to the COVID-19 pandemic in conflict settings: Policy reflections from Palestine,2020,5,0.6,4,1,"Pandemic, Socioeconomic status, Political science, Development economics, Refugee, Public health, Economic growth, Politics, Preparedness, Poverty, Disadvantaged, Political economy, Environmental health, Medicine, Sociology, Coronavirus disease 2019 (COVID-19), Population, Economics, Law, Disease, Pathology, Infectious disease (medical specialty), Nursing"
https://openalex.org/W3117672333,Regional lessons from the COVID-19 outbreak in the Middle East: From infectious diseases to climate change adaptation,2020,1,1.0,1,0,"Public health, Climate change, Outbreak, Geography, Context (archaeology), Politics, Political science, Development economics, Economic growth, Environmental health, Socioeconomics, Environmental resource management, Environmental planning, Medicine, Sociology, Ecology, Virology, Biology, Environmental science, Nursing, Archaeology, Law, Economics"
https://openalex.org/W3118213749,Assessment of Depression Severity During Coronavirus Disease 2019 Pandemic Among the Palestinian Population: A Growing Concern and an Immediate Consideration,2020,1,-1.0,0,1,"Depression (economics), Medicine, Anxiety, Public health, Pandemic, Population, Demography, Mental health, Coronavirus disease 2019 (COVID-19), Cross-sectional study, Psychiatry, Disease, Environmental health, Internal medicine, Infectious disease (medical specialty), Nursing, Pathology, Sociology, Economics, Macroeconomics"
https://openalex.org/W3092840490,"Palestinian strategies, guidelines, and challenges in the treatment and management of coronavirus disease-2019 (COVID-19)",2020,1,-1.0,0,1,"Medicine, Coronavirus disease 2019 (COVID-19), Outbreak, MEDLINE, Disease, Pandemic, Public health, Christian ministry, Family medicine, Medical emergency, Infectious disease (medical specialty), Intensive care medicine, Political science, Nursing, Virology, Pathology, Law"
https://openalex.org/W3087929985,"Immigrant women, nature and mental health",2020,1,-1.0,0,1,"Mental health, Immigration, Feeling, Alienation, Qualitative research, Psychology, Mood, Originality, Public health, Social psychology, Sociology, Medicine, Geography, Political science, Psychiatry, Nursing, Social science, Archaeology, Law"
