id,title,year,cited_by_count,cdIndex,ns,np,concepts_names
https://openalex.org/W2035720357,Breast Cancer Screening in Saudi Arabia: Free but Almost No Takers,2015,7,0.4285714285714285,5,2,"Breast cancer, Mammography, Medicine, Family medicine, Breast cancer screening, Public health, National Health Interview Survey, Health care, Cancer, Gerontology, Gynecology, Environmental health, Population, Nursing, Internal medicine, Economics, Economic growth"
https://openalex.org/W1536044601,"Tobacco consumption in the Kingdom of Saudi Arabia, 2013: findings from a national survey",2015,22,-0.0909090909090909,10,12,"Medicine, Tobacco control, Biostatistics, Environmental health, Public health, Population, Epidemiology, Demography, Confidence interval, Health care, Nursing, Sociology, Internal medicine, Economics, Economic growth"
https://openalex.org/W1865336837,Mass gathering and globalization of respiratory pathogens during the 2013 Hajj,2015,9,-0.7777777777777778,1,8,"Hajj, Streptococcus pneumoniae, Medicine, Haemophilus influenzae, Moraxella catarrhalis, Vaccination, Respiratory tract infections, Carriage, Cohort, Middle East respiratory syndrome coronavirus, Mass gathering, Immunology, Respiratory system, Public health, Microbiology, Biology, Internal medicine, Disease, Geography, Coronavirus disease 2019 (COVID-19), Infectious disease (medical specialty), Pathology, Antibiotics, Archaeology, Islam"
https://openalex.org/W2247074084,"Deficiencies under plenty of sun: Vitamin D status among adults in the kingdom of Saudi Arabia, 2013",2015,6,-0.6666666666666666,1,5,"Medicine, Vitamin D and neurology, vitamin D deficiency, Environmental health, Public health, Vitamin, Cross-sectional study, Diabetes mellitus, Osteoporosis, Gerontology, Psychiatry, Internal medicine, Pathology, Endocrinology"
https://openalex.org/W2411890062,"Multifacility Outbreak of Middle East Respiratory Syndrome in Taif, Saudi Arabia",2015,1,-1.0,0,1,"Outbreak, Middle East respiratory syndrome, Middle East respiratory syndrome coronavirus, Medicine, Serology, Transmission (telecommunications), Health care, Public health, Cluster (spacecraft), Internal medicine, Virology, Pediatrics, Infectious disease (medical specialty), Coronavirus disease 2019 (COVID-19), Antibody, Disease, Immunology, Pathology, Economic growth, Computer science, Economics, Electrical engineering, Programming language, Engineering"
https://openalex.org/W2413237091,Identifying Twitter influencer profiles for health promotion in Saudi Arabia,2015,1,1.0,1,0,"Social media, Health promotion, Public relations, Opinion leadership, Promotion (chess), Politics, Political science, Identification (biology), Public health, Advertising, Psychology, Business, Medicine, Nursing, Law, Botany, Biology"
https://openalex.org/W2219430871,Middle East Respiratory Syndrome– advancing the public health and research agenda on MERS- lessons from the South Korea outbreak,2015,3,-1.0,0,3,"Middle East respiratory syndrome, Outbreak, Middle East respiratory syndrome coronavirus, Public health, Coronavirus disease 2019 (COVID-19), Middle East, Geography, Political science, Economic growth, Medicine, Environmental health, Virology, Disease, Infectious disease (medical specialty), Nursing, Pathology, Archaeology, Economics"
https://openalex.org/W1979333417,Do routinely measured risk factors for obesity explain the sex gap in its prevalence? Observations from Saudi Arabia,2015,1,-1.0,0,1,"Medicine, Obesity, Mediation, Demography, Biostatistics, Socioeconomic status, Context (archaeology), Public health, Cross-sectional study, Epidemiology, National Health and Nutrition Examination Survey, Odds ratio, Gerontology, Environmental health, Population, Internal medicine, Geography, Nursing, Pathology, Sociology, Political science, Law, Archaeology"
https://openalex.org/W2120345690,"Progress toward malaria elimination in Jazan Province, Kingdom of Saudi Arabia: 2000–2014",2015,3,-1.0,0,3,"Malaria, Population, Geography, Socioeconomics, Incidence (geometry), Public health, Christian ministry, Environmental health, Demography, Medicine, Environmental protection, Political science, Immunology, Physics, Nursing, Sociology, Law, Optics"
https://openalex.org/W775044161,A Social Media Campaign to Promote Breastfeeding among Saudi Women: A Web-based Survey Study.,2015,3,1.0,3,0,"Breastfeeding, Outreach, Social media, Medicine, Breast feeding, Environmental health, Public health, Social support, Family medicine, Nursing, Psychology, Pediatrics, Political science, Social psychology, Law"
https://openalex.org/W2567631100,The epidemiology of congenital heart diseases in Saudi Arabia: A systematic review,2015,2,1.0,2,0,"Medicine, Epidemiology, Incidence (geometry), Etiology, Consanguinity, Population, Pediatrics, Public health, Disease, Demography, Environmental health, Internal medicine, Pathology, Physics, Sociology, Optics"
https://openalex.org/W2410676428,"eHealth in Saudi Arabia: Current Trends, Challenges and Recommendations.",2015,1,-1.0,0,1,"eHealth, Thematic analysis, Health informatics, Informatics, Health professionals, Health care, Qualitative research, Knowledge management, Nursing, Medicine, Medical education, Computer science, Political science, Public health, Sociology, Social science, Law"
https://openalex.org/W2115987793,"Prevalence and predictors of adolescents’ cigarette smoking in Madinah, Saudi Arabia: a school-based cross-sectional study",2015,6,-0.3333333333333333,2,4,"Medicine, Biostatistics, Cross-sectional study, Epidemiology, Environmental health, Multivariate analysis, Socioeconomic status, Cigarette smoking, Demography, Public health, Population, Internal medicine, Nursing, Pathology, Sociology"
https://openalex.org/W2217124365,Risk Factors for and Barriers to Control Type-2 Diabetes among Saudi Population,2015,1,1.0,1,0,"Type 2 diabetes, Medicine, Environmental health, Obesity, Population, Diabetes mellitus, Disease, Gerontology, MEDLINE, Public health, Risk factor, Nursing, Pathology, Endocrinology, Political science, Law"
https://openalex.org/W2415757576,"Knowledge, attitude, and practice of osteoporosis among Saudis",2015,1,-1.0,0,1,"Medicine, Seriousness, Residence, Osteoporosis, Family medicine, Public health, Cross-sectional study, Disease, Population, Health education, Environmental health, Health belief model, Gerontology, Demography, Nursing, Pathology, Sociology, Political science, Law"
https://openalex.org/W2004895577,"Effect of public knowledge, attitudes, and behavior on willingness to undergo colorectal cancer screening using the health belief model",2015,4,-1.0,0,4,"Medicine, Health belief model, Colorectal cancer, Marital status, Colonoscopy, Arabic, Cancer screening, Disease, Population, Family history, Family medicine, Cancer, Public health, Gerontology, Gynecology, Health education, Internal medicine, Environmental health, Pathology, Linguistics, Philosophy"
https://openalex.org/W1800957512,Australian Hajj pilgrims' infection control beliefs and practices: Insight with implications for public health approaches,2015,1,1.0,1,0,"Hajj, Medicine, Mass gathering, Public health, Vaccination, Family medicine, Fatalism, Infection control, Qualitative research, Feeling, Environmental health, Psychology, Nursing, Immunology, Social psychology, Surgery, Social science, Philosophy, Theology, Sociology, Islam"
https://openalex.org/W2134058936,"Trends in Current Tobacco Use, Smoking Rates and Quit Attempts among Saudi Population during Periods of 17 Years (1996-2012): Narrative Review Article.",2015,4,-0.5,1,3,"Tobacco control, Tobacco use, Medicine, Government (linguistics), Consumption (sociology), Environmental health, Narrative review, Atlanta, Population, Public health, Metropolitan area, Social science, Linguistics, Philosophy, Nursing, Pathology, Sociology, Intensive care medicine"
https://openalex.org/W2145780445,A lesson learned from Middle East respiratory syndrome (MERS) in Saudi Arabia,2015,6,1.0,6,0,"Middle East respiratory syndrome, Public health, Population, Medicine, Agency (philosophy), Politics, Economic growth, Workforce, Psychosocial, Health care, Middle East, Public relations, Nursing, Political science, Disease, Environmental health, Coronavirus disease 2019 (COVID-19), Sociology, Law, Psychiatry, Social science, Pathology, Infectious disease (medical specialty), Economics"
https://openalex.org/W1496430659,Assessment of knowledge of celiac disease among health care professionals,2015,2,-1.0,0,2,"Medicine, Family medicine, Disease, Public health, Health professionals, Health care, Cross-sectional study, Nursing, Pathology, Economics, Economic growth"
https://openalex.org/W1571326890,"Osteoporosis Health Beliefs, Knowledge and Life Habits among Women in Saudi Arabia",2015,1,-1.0,0,1,"Medicine, Osteoporosis, Family history, Psychological intervention, Cross-sectional study, Gerontology, Significant difference, Health belief model, Public health, Demography, Environmental health, Health education, Internal medicine, Psychiatry, Nursing, Pathology, Sociology"
https://openalex.org/W1580535482,"Second-Hand Smoking among Intermediate and Secondary School Students in Madinah, Saudi Arabia",2015,2,-1.0,0,2,"Medicine, Environmental health, Cross-sectional study, Public health, Smoking prevalence, Demography, Population, Nursing, Pathology, Sociology"
https://openalex.org/W2191111731,Pattern of Patients and Diseases During Mass Transit: The Day of Arafat Experience,2015,2,1.0,2,0,"Hajj, Medicine, Mass gathering, Intervention (counseling), Medical emergency, Transit (satellite), Family medicine, Islam, Nursing, Public health, Public transport, Philosophy, Theology, Political science, Law"
https://openalex.org/W2395944696,The Role of Social Media in Promoting Women's Health Education in Saudi Arabia.,2015,3,1.0,3,0,"Social media, Health education, Health information, Health promotion, Psychological intervention, Penetration rate, Medicine, Psychology, Political science, Health care, Public health, Nursing, Engineering, Geotechnical engineering, Law"
https://openalex.org/W2158812591,Outcomes of a type 2 diabetes education program adapted to the cultural contexts of Saudi women,2015,1,1.0,1,0,"Medicine, Intervention (counseling), Type 2 diabetes, Quality of life (healthcare), Gerontology, Family medicine, Health education, Program evaluation, Focus group, Nursing, Diabetes mellitus, Physical therapy, Public health, Public administration, Marketing, Political science, Business, Endocrinology"
https://openalex.org/W2082954226,Prevalence and behavioral risk factors for STIs/HIV among attendees of the Ministry of Health hospitals in Saudi Arabia,2015,1,-1.0,0,1,"Medicine, Christian ministry, Demography, Marital status, Cross-sectional study, Public health, Human immunodeficiency virus (HIV), Men who have sex with men, Environmental health, Population, Family medicine, Syphilis, Philosophy, Theology, Nursing, Pathology, Sociology"
https://openalex.org/W2463555285,Current epidemiological situation of Middle East respiratory syndrome coronavirus clusters and implications for public health response in South Korea,2015,1,-1.0,0,1,"Middle East respiratory syndrome coronavirus, Triage, Outbreak, Middle East, Middle East respiratory syndrome, Medicine, Peninsula, Health care, Epidemiology, Public health, Transmission (telecommunications), Cluster (spacecraft), Environmental health, Demography, Coronavirus disease 2019 (COVID-19), Medical emergency, Geography, Disease, Virology, Economic growth, Pathology, Infectious disease (medical specialty), Archaeology, Engineering, Sociology, Computer science, Electrical engineering, Economics, Programming language"
https://openalex.org/W2397255504,Using a digital marketing platform for the promotion of an internet based health encyclopedia in saudi arabia.,2015,1,1.0,1,0,"The Internet, Encyclopedia, Digital marketing, Documentation, Promotion (chess), Work (physics), Business, Social marketing, Health promotion, World Wide Web, Marketing, Medicine, Computer science, Public health, Engineering, Nursing, Political science, Library science, Mechanical engineering, Politics, Law, Programming language"
https://openalex.org/W2320486610,Factors influencing decisions to enroll in the health informatics educational programs,2015,1,1.0,1,0,"Reputation, Medical education, Informatics, Health informatics, Health care, Psychology, Quality (philosophy), Population, Medicine, Nursing, Public relations, Political science, Environmental health, Public health, Philosophy, Epistemology, Law"
https://openalex.org/W1605930554,The crowd psychology of the Hajj,2015,1,1.0,1,0,"Hajj, Feeling, Identity (music), Perception, Identification (biology), Psychology, Mass gathering, Social psychology, Social identity theory, Categorization, Applied psychology, Medicine, Geography, Social group, Computer science, Islam, Aesthetics, Public health, Philosophy, Botany, Nursing, Archaeology, Neuroscience, Artificial intelligence, Biology"
https://openalex.org/W1531991964,The lifestyle habits and wellbeing of physicians in Bahrain: a cross-sectional study,2015,1,1.0,1,0,"Medicine, Biostatistics, Cross-sectional study, Overweight, Body mass index, Public health, Obesity, Affect (linguistics), Family medicine, Diabetes mellitus, Gerontology, Demography, Internal medicine, Nursing, Linguistics, Philosophy, Pathology, Endocrinology, Sociology"
https://openalex.org/W2104198501,Leishmaniasis in Yemen: a clinicoepidemiological study of leishmaniasis in central Yemen,2015,1,1.0,1,0,"Leishmaniasis, Mucocutaneous zone, Medicine, Cutaneous leishmaniasis, Epidemiology, Visceral leishmaniasis, Canine leishmaniasis, Leishmania, Public health, Disease, Outbreak, Environmental health, Dermatology, Leishmania infantum, Immunology, Pathology, Parasite hosting, World Wide Web, Computer science"
https://openalex.org/W3122305064,The Regulatory Welfare State in Pension Markets: Mitigating High Charges for Low-Income Savers in the United Kingdom and Israel,2016,6,-1.0,0,6,"Pension, Welfare state, Welfare, Business, Citizenship, State (computer science), Public economics, Social Welfare, Economics, Market economy, Finance, Political science, Politics, Law, Algorithm, Computer science"
https://openalex.org/W2558467544,When the Clients Can Choose: Dilemmas of Street-Level Workers in Choice-Based Social Services,2016,3,-0.3333333333333333,1,2,"Social work, Business, Public relations, Coping (psychology), Social Welfare, Marketing, Nursing, Psychology, Economics, Economic growth, Medicine, Political science, Law, Psychiatry"
https://openalex.org/W2271945149,Rise of the Regulatory Welfare State? Social Regulation in Utilities in Israel,2016,5,-1.0,0,5,"Arrears, Liberalization, Social Welfare, Welfare state, Economics, Social policy, Public economics, Regulatory reform, State (computer science), Economic policy, Market economy, Welfare, Economic system, Debt, Political science, Politics, Finance, Law, Algorithm, Computer science"
https://openalex.org/W2528061453,"Low-Income Women’s Encounters with Social Services: Negotiation over Power, Knowledge and Respectability",2016,2,-1.0,0,2,"Social work, Dignity, Poverty, Sociology, Social exclusion, Shame, Social Welfare, Humiliation, Social psychology, Gender studies, Psychology, Political science, Law"
https://openalex.org/W393499185,"Social Justice, Legitimacy and the Welfare State",2016,2,1.0,2,0,"Legitimacy, Welfare state, Economic Justice, Social justice, Political science, State (computer science), Social Welfare, Welfare, Sociology, Political economy, Law and economics, Computer science, Law, Politics, Algorithm"
https://openalex.org/W2263224737,The relationship between natural gas consumption and economic growth in OPEC members,2016,1,-1.0,0,1,"Economics, Granger causality, Consumption (sociology), Causality (physics), Neutrality, Panel data, Development economics, Economy, International economics, International trade, Macroeconomics, Econometrics, Political science, Social science, Sociology, Physics, Quantum mechanics, Law"
https://openalex.org/W2566021644,Neutrality in medicine and health professionals from ethnic minority groups: The case of Arab health professionals in Israel,2016,3,-1.0,0,3,"Neutrality, Ethos, Inclusion (mineral), Impartiality, Ethnic group, Health care, Politics, Public relations, Sociology, Political science, Medicine, Law, Gender studies"
https://openalex.org/W2408399288,Earned Citizenship: Labour Migrants’ Views on the Welfare State,2016,3,-0.3333333333333333,1,2,"Welfare state, Citizenship, Welfare, Immigration, State (computer science), Political science, Population, Social security, Solidarity, Sociology, Demographic economics, Economics, Law, Politics, Demography, Algorithm, Computer science"
https://openalex.org/W2462680527,"An investigation of the unexpectedly high fertility of secular, native-born Jews in Israel",2016,1,-1.0,0,1,"Fertility, Welfare state, Ideology, Secular education, Sociology, Politics, Political science, Judaism, Welfare, Population, Demographic economics, Economic growth, Development economics, Gender studies, Demography, Geography, Economics, Law, Archaeology"
https://openalex.org/W2504986864,Horizontal Inequality in Israel’s Welfare State: Do Arab Citizens Receive Fewer Transfer Payments?,2016,1,-1.0,0,1,"Poverty, Redistribution (election), Welfare, Payment, Judaism, Welfare state, Transfer payment, Political science, State (computer science), Inequality, Development economics, Economics, Demographic economics, Economic growth, Geography, Law, Finance, Politics, Mathematical analysis, Mathematics, Archaeology, Algorithm, Computer science"
https://openalex.org/W2564652778,Malnutrition in Yemen: an invisible crisis,2016,1,-1.0,0,1,"Malnutrition, Famine, Humanitarian crisis, Poverty, Population, Medicine, Economic shortage, Food security, Socioeconomics, Millennium Development Goals, Economic growth, Environmental health, Refugee, Geography, Political science, Government (linguistics), Agriculture, Linguistics, Philosophy, Archaeology, Pathology, Sociology, Economics"
https://openalex.org/W2274910509,Who's been left behind? Why sustainable development goals fail the Arab world,2016,1,1.0,1,0,"Sustainable development, Poverty, Political science, Scopus, Millennium Development Goals, Human development (humanity), Economic growth, Human Development Report, Human rights, Human Development Index, Medicine, Law, MEDLINE, Economics"
https://openalex.org/W2468906354,Mental illness research in the Gulf Cooperation Council: a scoping review,2016,3,-1.0,0,3,"Mental health, Mental illness, Medicine, Context (archaeology), Inclusion (mineral), Health services research, Service (business), Health administration, Empirical research, Nursing, Public health, Psychiatry, Sociology, Business, Social science, Paleontology, Philosophy, Epistemology, Marketing, Biology"
https://openalex.org/W2469362410,Health Sciences Students’ Self-Assessment of Information and Communication Technology Skills and Attitude Toward e-Learning,2016,1,1.0,1,0,"Information and Communications Technology, Medical education, Informatics, Computer literacy, Health informatics, Observational study, Psychology, Word processing, Mathematics education, Computer science, Medicine, Nursing, Engineering, World Wide Web, Public health, Pathology, Natural language processing, Electrical engineering"
https://openalex.org/W2559402433,Protecting public health in Yemen,2016,4,0.5,3,1,"Sanitation, Humanitarian aid, Cholera, Public health, Vulnerability (computing), Outbreak, Political science, Medicine, Law, Computer security, Virology, Nursing, Pathology, Computer science"
https://openalex.org/W2310609024,"Syrian Refugees, Health and Migration Legislation in Turkey",2016,6,1.0,6,0,"Refugee, Public health, Political science, Turkish, European union, Legislation, Public health law, Economic growth, Overcrowding, Health policy, Environmental health, Development economics, International health, Law, Medicine, Health care, Business, International trade, Economics, Nursing, Linguistics, Philosophy"
https://openalex.org/W2501761880,The prevalence and impact of risk factors for ethnic differences in loneliness,2016,1,-1.0,0,1,"Loneliness, Ethnic group, Turkish, Feeling, Socioeconomic status, Psychology, Public health, Social isolation, Medicine, Demography, Environmental health, Social psychology, Psychiatry, Political science, Sociology, Population, Linguistics, Philosophy, Nursing, Law"
https://openalex.org/W2510265942,Ethnic Disparities in Dental Caries among Six-Year-Old Children in the Netherlands,2016,1,-1.0,0,1,"Ethnic group, Medicine, Turkish, Generation R, Odds, Demography, Cross-sectional study, Odds ratio, Oral health, Population, Immigration, Public health, Dentistry, Environmental health, Logistic regression, Geography, Linguistics, Philosophy, Pathology, Sociology, Anthropology, Internal medicine, Nursing, Archaeology"
https://openalex.org/W2609281271,Health Beliefs and Breast Cancer Screening Behavior among a Group of Female Health Professionals in Turkey,2016,1,-1.0,0,1,"Medicine, Family medicine, Breast cancer screening, Mammography, Breast cancer, Breast self-examination, Health belief model, Champion, Turkish, Perception, Health professionals, Gynecology, Nursing, Health care, Health education, Cancer, Public health, Psychology, Internal medicine, Linguistics, Philosophy, Neuroscience, Political science, Law, Economics, Economic growth"
https://openalex.org/W2488280687,“Quitting like a Turk:” How political priority developed for tobacco control in Turkey,2016,3,-0.3333333333333333,1,2,"Tobacco control, Politics, European union, Public health, Political science, Tobacco industry, Sociology, Medicine, Business, Law, International trade, Nursing"
https://openalex.org/W2537479278,Violence towards women is a public health problem,2016,1,1.0,1,0,"Domestic violence, Sexual violence, Context (archaeology), Public health, Turkish, Poison control, Psychosocial, Occupational safety and health, Suicide prevention, Psychology, Medicine, Gerontology, Psychiatry, Environmental health, Criminology, Geography, Nursing, Linguistics, Philosophy, Archaeology, Pathology"
https://openalex.org/W2523287175,(Non-)utilization of pre-hospital emergency care by migrants and non-migrants in Germany,2016,1,-1.0,0,1,"Turkish, Medicine, German, Demographics, Public health, Cross-sectional study, Sample (material), Immigration, Demography, Environmental health, Medical emergency, Family medicine, Geography, Nursing, Sociology, Philosophy, Linguistics, Chemistry, Archaeology, Pathology, Chromatography"
https://openalex.org/W2534120050,Cholera in the time of war: implications of weak surveillance in Syria for the WHO's preparedness—a comparison of two monitoring systems,2016,7,0.1428571428571428,4,3,"Public health, Government (linguistics), Preparedness, Context (archaeology), Public health surveillance, Environmental health, Medicine, Cholera, Disease surveillance, Outbreak, Business, Medical emergency, Political science, Geography, Virology, Nursing, Linguistics, Philosophy, Archaeology, Law"
https://openalex.org/W2559522703,The Current Status of Ticks in Turkey: A 100-Year Period Review from 1916 to 2016,2016,3,-1.0,0,3,"Tick, Argasidae, Tick-borne disease, Public health, Vector (molecular biology), Veterinary medicine, Geography, Socioeconomics, Biology, Ixodidae, Ecology, Environmental health, Medicine, Economics, Biochemistry, Nursing, Gene, Recombinant DNA"
https://openalex.org/W2515468225,Effect of primary health care reforms in Turkey on health service utilization and user satisfaction,2016,3,0.3333333333333333,2,1,"Medicine, Family medicine, Public health, Health care, Service (business), Nursing, Environmental health, Business, Economic growth, Marketing, Economics"
https://openalex.org/W2306193661,Use of healthcare services in the region of origin among patients with an immigrant background in Denmark: a qualitative study of the motives,2016,1,-1.0,0,1,"Immigration, Health care, Health administration, Nursing research, Qualitative research, Residence, Medicine, Country of origin, Feeling, Focus group, Health informatics, Quality (philosophy), Health services research, Perception, Nursing, Psychology, Public health, Demographic economics, Social psychology, Business, Political science, Sociology, Marketing, Social science, Philosophy, Epistemology, Neuroscience, Economics, Law"
https://openalex.org/W2563154768,Comparison of tobacco control programs worldwide: A quantitative analysis of the 2015 World Health Organization MPOWER report,2016,4,-1.0,0,4,"Checklist, Tobacco control, Medicine, Environmental health, Developing country, Public health, Economic growth, Psychology, Nursing, Cognitive psychology, Economics"
https://openalex.org/W2590774972,"Smoking Cessation and Attitudes, Belief, Observation, and Education of Medical Students, in Turkey",2016,1,1.0,1,0,"Medicine, Smoking cessation, Health professionals, Family medicine, Public health, Population, Nicotine replacement therapy, Health education, Nursing, Environmental health, Health care, Pathology, Economics, Economic growth"
https://openalex.org/W2240038051,Erratum to: Measuring Multidimensional Inequality in the OECD Member Countries with a Distribution-Sensitive Better Life Index,2016,1,-1.0,0,1,"Quality of Life Research, Human geography, Index (typography), Inequality, Public health, Distribution (mathematics), Geography, Econometrics, Economics, Economic geography, Medicine, Mathematics, Computer science, Mathematical analysis, World Wide Web, Nursing"
