id,title,year,cited_by_count,cdIndex,ns,np,concepts_names
https://openalex.org/W1985485697,The Lancet conference on mass gatherings medicine,2010,5,1.0,5,0,"Mass gathering, Hajj, Event (particle physics), Pilgrimage, Islam, History, Geography, Political science, Medicine, Ancient history, Public health, Archaeology, Nursing, Physics, Quantum mechanics"
https://openalex.org/W2099736704,Breastfeeding knowledge and attitude among Saudi women in Central Saudi Arabia.,2010,1,-1.0,0,1,"Breastfeeding, Medicine, Family medicine, Arabic, Breast feeding, Health education, Pediatrics, Obstetrics, Nursing, Public health, Philosophy, Linguistics"
https://openalex.org/W2155335061,Misconceptions about diabetes mellitus among adult male attendees of primary health care centres in Eastern Saudi Arabia,2010,1,-1.0,0,1,"Medicine, Etiology, Logistic regression, Diabetes mellitus, Incidence (geometry), Primary health care, Primary care, Population, Family medicine, Public health, Disease, Pediatrics, Demography, Environmental health, Gerontology, Internal medicine, Nursing, Endocrinology, Physics, Sociology, Optics"
https://openalex.org/W2124632790,The Impact of Information Technology and Organizational Focus on the Visibility of Patient Care Errors,2010,1,1.0,1,0,"Patient safety, Health care, Organizational culture, Health informatics, Visibility, Informatics, Information technology, Quality (philosophy), Control (management), Nursing, Psychology, Medicine, Medical education, Computer science, Public health, Public relations, Political science, Philosophy, Physics, Optics, Epistemology, Artificial intelligence, Law, Operating system"
https://openalex.org/W1949069503,Anatomy of an oil-based welfare state: rent distribution in Kuwait,2011,1,1.0,1,0,"Subsidy, Scope (computer science), Distribution (mathematics), Welfare, State (computer science), Welfare state, Social Welfare, Distribution of wealth, Economics, Poverty, Business, Distributive property, Public economics, Economic policy, Market economy, Inequality, Economic growth, Political science, Politics, Mathematical analysis, Mathematics, Algorithm, Computer science, Pure mathematics, Law, Programming language"
https://openalex.org/W2054145075,Social Discount Rates and Welfare Weights for Public Investment Decisions under Budgetary Restrictions: The Case of Cyprus*,2011,1,-1.0,0,1,"Discounting, Economics, Social discount rate, Welfare, Investment (military), Order (exchange), Social planner, Planner, Public economics, Social Welfare, Turkish, Estimation, Cost–benefit analysis, Consumption (sociology), Commission, Microeconomics, Finance, Political science, Sociology, Computer science, Market economy, Social science, Programming language, Linguistics, Philosophy, Management, Politics, Law"
https://openalex.org/W3124210252,Partisan Activism and Access to Welfare in Lebanon,2011,5,1.0,5,0,"Clientelism, Politics, Social Welfare, Welfare, Ethnic group, Political science, State (computer science), Public administration, Sociology, Welfare state, Political economy, Public relations, Economic growth, Economics, Law, Algorithm, Computer science, Democracy"
https://openalex.org/W2096955760,Partisan Activism and Access to Welfare in Lebanon,2011,1,1.0,1,0,"Clientelism, Politics, Political science, Social Welfare, Welfare, Ethnic group, Public administration, State (computer science), Welfare state, Public relations, Political economy, Sociology, Law, Algorithm, Computer science, Democracy"
https://openalex.org/W2011909898,Client Violence and Mental Health Status among Iranian Social Workers: A National Survey,2011,1,-1.0,0,1,"Social work, Statistician, Social Welfare, Welfare, Sociology, Social science, Political science, Medicine, Law, Pathology"
https://openalex.org/W2159234827,Public attitudes towards the welfare state and public policy: the Israeli experience,2011,3,-1.0,0,3,"Public opinion, Welfare state, Welfare, Social policy, State (computer science), Investment (military), Public policy, Obligation, Social Welfare, Political science, Public economics, Intervention (counseling), Business, Public administration, Economic growth, Economics, Politics, Law, Medicine, Algorithm, Psychiatry, Computer science"
https://openalex.org/W2016836869,Vocational Choice and Attitudes toward Welfare Policy,2011,3,0.3333333333333333,2,1,"Social policy, Vocational education, Curriculum, Welfare, Dominance (genetics), Welfare state, Social work, Social Welfare, Social psychology, Psychology, Sociology, Public relations, Political science, Pedagogy, Politics, Law, Biochemistry, Chemistry, Gene"
https://openalex.org/W2258737265,The Impact of Monetary Variables on Economic Growth in Iran: A Monetarists' Approach,2011,1,1.0,1,0,"Monetarism, Economics, Real gross domestic product, Classical dichotomy, Neutrality, Gross domestic product, Monetary economics, Money supply, Monetary policy, Production (economics), Monetary base, Inflation (cosmology), Unemployment, Macroeconomics, Econometrics, Velocity of money, Endogenous money, Philosophy, Physics, Epistemology, Theoretical physics"
https://openalex.org/W2793808142,Archaeologist under Pressure: Neutral or Cooperative in Wartime,2011,1,1.0,1,0,"Neutrality, Sovereignty, State (computer science), Human rights, Political science, Law, Civil society, Armed conflict, International humanitarian law, Key (lock), Law and economics, Environmental ethics, Political economy, Sociology, Philosophy, Politics, Computer security, Computer science, Algorithm"
https://openalex.org/W2171722074,The Politics of Religiously Motivated Welfare Provision,2011,2,-1.0,0,2,"Welfare state, Retrenchment, Realm, Political science, Political economy, State (computer science), Politics, Citizenship, Civil society, Public sphere, Argument (complex analysis), Democracy, Development economics, Sociology, Public administration, Law, Economics, Biochemistry, Chemistry, Algorithm, Computer science"
https://openalex.org/W2096233744,Work-family policies and the effects of children on women's employment hours and wages,2011,2,-1.0,0,2,"Generosity, Wage, Work (physics), Demographic economics, Welfare, Parental leave, Labour economics, Economics, Gender equality, Welfare state, Work hours, Paid work, Political science, Sociology, Working hours, Mechanical engineering, Engineering, Market economy, Gender studies, Politics, Law"
https://openalex.org/W577897830,The Israeli Third Sector: Between Welfare State and Civil Society,2011,3,1.0,3,0,"Civil society, Welfare, State (computer science), Welfare state, Third world, Political science, Water sector, Development economics, Economics, Engineering, Law, Computer science, Water supply, Algorithm, Environmental engineering, Politics"
https://openalex.org/W1574560090,From Enlightened Self-interest to Welfare Coalitions: Overcoming Identity-based Tensions in the Israeli Welfare State,2011,1,-1.0,0,1,"Solidarity, Welfare state, Politics, Welfare, Argument (complex analysis), Disadvantaged, Context (archaeology), Political science, Welfare reform, Political economy, Identity (music), Sociology, Social policy, Voting, Law, Paleontology, Biochemistry, Chemistry, Physics, Acoustics, Biology"
https://openalex.org/W642607322,NGOs and the Struggle for Human Rights in Europe,2011,1,1.0,1,0,"Human rights, Convention, Political science, International human rights law, Impunity, Law, Individualism, Linguistic rights, Right to property, Politics, Fundamental rights"
https://openalex.org/W1991480223,Reservations on the “Convention on the Elimination of All Forms of Discrimination against Women (CEDAW)” Based on Islam and its Practical Application in Jordan: Legal Perspectives,2011,2,1.0,2,0,"Convention on the Elimination of All Forms of Discrimination Against Women, Islam, Convention, Law, Reservation, Political science, Sharia, Sociology, Human rights, History, International human rights law, Archaeology"
https://openalex.org/W2594464723,Social determinants of reproductive health in Morocco.,2011,1,-1.0,0,1,"Fertility, Reproductive health, Geography, Population, Demography, Infant mortality, Rural area, Millennium Development Goals, Socioeconomics, Inequality, Developing country, Family planning, Maternal health, Total fertility rate, Cluster (spacecraft), Child mortality, Economic growth, Environmental health, Medicine, Research methodology, Health services, Sociology, Mathematical analysis, Mathematics, Pathology, Computer science, Economics, Programming language"
https://openalex.org/W1513770506,Epidemiology of hepatitis C in the Middle East.,2011,2,1.0,2,0,"Middle East, Epidemiology, Medicine, Transmission (telecommunications), Public health, Environmental health, Population, Socioeconomics, Geography, Pathology, Archaeology, Engineering, Sociology, Electrical engineering"
https://openalex.org/W2017438387,Diabetes care in the age of informatics,2011,1,1.0,1,0,"Diabetes mellitus, Informatics, Computer science, Health informatics, Medicine, Nursing, Engineering, Endocrinology, Electrical engineering, Public health"
https://openalex.org/W2057135645,The health status of first- and second-generation Turkish immigrants in Germany,2011,3,0.3333333333333333,2,1,"Turkish, Immigration, German, Logistic regression, Public health, Coping (psychology), Demography, Medicine, Environmental health, Demographic economics, Gerontology, Geography, Sociology, Clinical psychology, Philosophy, Linguistics, Nursing, Archaeology, Internal medicine, Economics"
https://openalex.org/W1993864651,A snapshot of the organization and provision of primary care in Turkey,2011,3,0.3333333333333333,2,1,"Health administration, Medicine, Health informatics, Nursing, Family doctors, Clinical governance, Primary health care, Primary care, Economic shortage, Nursing research, Family medicine, Questionnaire, Corporate governance, Health care, Public health, Business, Environmental health, Government (linguistics), Economic growth, Finance, Population, Linguistics, Philosophy, Economics, Social science, Sociology"
https://openalex.org/W2079967895,Balcova heart study: rationale and methodology of the Turkish cohort,2011,3,-0.3333333333333333,1,2,"Medicine, Anthropometry, Cohort, Turkish, Psychological intervention, Environmental health, Cohort study, Public health, Prospective cohort study, Gerontology, Coronary heart disease, Demography, Surgery, Internal medicine, Nursing, Philosophy, Linguistics, Sociology"
https://openalex.org/W2102666888,The health sector reforms and the efficiency of public hospitals in Turkey: provincial markets,2011,5,-0.2,2,3,"Data envelopment analysis, Productivity, Disadvantaged, Health care, Public sector, Malmquist index, Public health care, Business, Index (typography), Public health, Economics, Medicine, Economic growth, Health policy, Total factor productivity, Nursing, Economy, Statistics, World Wide Web, Computer science, Mathematics"
https://openalex.org/W2005069449,"Overweight at age two years in a multi-ethnic cohort (ABCD study): the role of prenatal factors, birth outcomes and postnatal factors",2011,1,-1.0,0,1,"Overweight, Medicine, Body mass index, Demography, Ethnic group, Obesity, Cohort, Odds ratio, Pregnancy, Logistic regression, Turkish, Epidemiology, Cohort study, Birth weight, Public health, Prenatal care, Pediatrics, Population, Environmental health, Internal medicine, Linguistics, Philosophy, Nursing, Sociology, Biology, Anthropology, Genetics"
https://openalex.org/W2013927871,Alcohol consumption and binge drinking in adolescents: comparison of different migration backgrounds and rural vs. urban residence - a representative study,2011,1,-1.0,0,1,"Binge drinking, Rural area, Residence, Medicine, Epidemiology, Biostatistics, Environmental health, Demography, Public health, Consumption (sociology), Poison control, Injury prevention, Social science, Nursing, Pathology, Sociology, Internal medicine"
https://openalex.org/W2152245932,Hepatitis B prevalence in the Turkish population of Arnhem: implications for national screening policy?,2011,1,1.0,1,0,"HBsAg, Medicine, Hepatitis B, Population, Turkish population, Hepatitis C, Hepatitis, Turkish, Public health, Hepatitis B virus, Virology, Immunology, Environmental health, Virus, Biology, Pathology, Biochemistry, Linguistics, Philosophy, Genotype, Gene"
https://openalex.org/W2075503641,Cost of pneumococcal infections and cost-effectiveness analysis of pneumococcal vaccination at risk adults and elderly in Turkey,2011,1,1.0,1,0,"Medicine, Vaccination, Pneumococcal pneumonia, Pneumonia, Pneumococcal infections, Public health, Epidemiology, Pneumococcal vaccination, Pediatrics, Environmental health, Immunology, Internal medicine, Streptococcus pneumoniae, Nursing, Biology, Bacteria, Genetics"
https://openalex.org/W2230401965,Turkey. Health system review.,2011,17,0.8823529411764706,16,1,"Life expectancy, Social security, Health care, Infant mortality, Purchasing power, Business, Economic growth, Population, Health policy, Public health, Medicine, Environmental health, Socioeconomics, Political science, Economics, Nursing, Keynesian economics, Law"
https://openalex.org/W2057460758,"Governing population, public health, and malaria in the early Turkish republic",2011,5,1.0,5,0,"Turkish, Malaria, Public health, Turkish population, Political science, Population, Geography, Economic growth, Development economics, Environmental health, Medicine, Biology, Economics, Immunology, Nursing, Philosophy, Linguistics, Biochemistry, Genotype, Gene"
https://openalex.org/W2158211685,Health Promotion and Risk Behaviors Among Adolescents in Turkey,2011,1,-1.0,0,1,"Cronbach's alpha, Health promotion, Turkish, Scale (ratio), Medicine, Promotion (chess), Test (biology), Clinical psychology, Psychology, Family medicine, Environmental health, Gerontology, Public health, Psychometrics, Nursing, Linguistics, Philosophy, Physics, Paleontology, Quantum mechanics, Politics, Political science, Law, Biology"
https://openalex.org/W2146074569,The Effects of Peer Education on Reduction of the HIV/Sexually Transmitted Infection Risk Behaviors Among Turkish University Students,2011,3,0.3333333333333333,2,1,"Condom, Turkish, Sexual intercourse, Safer sex, Human immunodeficiency virus (HIV), Medicine, Psychology, Peer education, Clinical psychology, Demography, Population, Health education, Family medicine, Public health, Environmental health, Nursing, Syphilis, Sociology, Linguistics, Philosophy"
https://openalex.org/W2160450996,"Stillbirth differences according to regions of origin: an analysis of the German perinatal database, 2004-2007",2011,2,1.0,2,0,"Medicine, Demography, Reproductive medicine, Relative risk, Population, Pregnancy, Public health, Environmental health, Health care, Obstetrics, Confidence interval, Nursing, Sociology, Internal medicine, Economics, Biology, Economic growth, Genetics"
https://openalex.org/W2116584864,A prospective cohort study of dietary patterns of non-western migrants in the Netherlands in relation to risk factors for cardiovascular diseases: HELIUS-Dietary Patterns,2011,2,-1.0,0,2,"Ethnic group, Biostatistics, Medicine, Environmental health, Epidemiology, Turkish, Western diet, Cohort study, Disease, Population, Demography, Gerontology, Cohort, Public health, Nutritional epidemiology, Obesity, Pathology, Linguistics, Philosophy, Sociology, Anthropology"
https://openalex.org/W187925017,Testicular cancer awareness and testicular self-examination among university students.,2011,1,-1.0,0,1,"Testicular cancer, Curriculum, Medicine, Gynecology, Sign (mathematics), Family medicine, Cancer, Health education, Demography, Psychology, Medical education, Internal medicine, Pathology, Pedagogy, Sociology, Public health, Mathematical analysis, Mathematics"
https://openalex.org/W2070104864,Social and cultural factors underlying generational differences in overweight: a cross-sectional study among ethnic minorities in the Netherlands,2011,2,-1.0,0,2,"Overweight, Demography, Biostatistics, Socioeconomic status, Body mass index, Ethnic group, Medicine, Cross-sectional study, Acculturation, Odds ratio, Turkish, Gerontology, Logistic regression, Public health, Environmental health, Population, Sociology, Linguistics, Philosophy, Nursing, Pathology, Anthropology, Internal medicine"
https://openalex.org/W2811273,"Knowledge, facilitators and perceived barriers for early detection of breast cancer among elderly Turkish women.",2011,3,-1.0,0,3,"Turkish, Medicine, Breast cancer screening, Neglect, Embarrassment, Qualitative research, Breast cancer, Focus group, Health belief model, Family medicine, Health promotion, Breast self-examination, Mammography, Nursing, Cancer screening, Public health, Psychology, Cancer, Social psychology, Social science, Philosophy, Linguistics, Marketing, Sociology, Internal medicine, Business"
https://openalex.org/W2149282450,Attitudes and Health Beliefs Associated With Breast Cancer Screening Behaviors Among Turkish Women,2011,3,-1.0,0,3,"Breast self-examination, Medicine, Turkish, Breast cancer, Mammography, Breast cancer screening, Health belief model, Confidence interval, Family medicine, Gynecology, Clinical psychology, Cancer, Obstetrics, Health education, Public health, Nursing, Internal medicine, Linguistics, Philosophy"
https://openalex.org/W2092382035,"Religious Officials' knowledge, attitude, and behavior towards smoking and the new tobacco law in Kahramanmaras, Turkey",2011,1,-1.0,0,1,"Tobacco control, Islam, Law, Biostatistics, Population, Medicine, Religious belief, Public health, Political science, Environmental health, Theology, Nursing, Philosophy, Epistemology"
https://openalex.org/W2010776090,Discrimination in health care industry: a research on public hospitals,2011,1,1.0,1,0,"Solidarity, Originality, Health care, Public health, Public relations, Ideology, Exploratory research, Psychology, Nursing, Politics, Sociology, Political science, Medicine, Social psychology, Social science, Law, Creativity"
https://openalex.org/W2329016864,"Seasonal Distribution and Economic Importance of Cystic Echinococcosis in Cattle Slaughtered at Kars Municipal Abattoir, Turkey",2011,1,-1.0,0,1,"Cystic echinococcosis, Veterinary medicine, Echinococcosis, Incidence (geometry), Zoonotic disease, Medicine, Distribution (mathematics), Public health, Environmental health, Surgery, Disease, Internal medicine, Pathology, Mathematical analysis, Physics, Mathematics, Optics"
https://openalex.org/W2064053724,Privatization of health and publicization of violence: violence toward doctors in Turkey,2011,1,1.0,1,0,"Devaluation, Public health, Restructuring, Context (archaeology), Health policy, Health care, Business, Political science, Economic growth, Medicine, Nursing, Economics, Geography, Law, Archaeology, Finance, Exchange rate"
https://openalex.org/W2138673484,"Knowledge, attitude and beliefs women attending mammography units have regarding breast cancer and early diagnosis.",2011,1,-1.0,0,1,"Mammography, Medicine, Breast cancer, Gynecology, Family medicine, Health belief model, Breast self-examination, Breast cancer screening, Obstetrics, Population, Turkish, Cancer, Health education, Nursing, Public health, Internal medicine, Environmental health, Linguistics, Philosophy"
https://openalex.org/W1607344220,GOVERNMENT RESPONSIVENESS: THE EXTENT OF EQUITY IN HEALTH SERVICES IN TURKEY,2011,1,1.0,1,0,"Equity (law), Health care, Health equity, Health policy, Business, Public economics, Public sector, Population, Government (linguistics), Public health, Economic growth, Health promotion, Economics, Environmental health, Political science, Medicine, Nursing, Linguistics, Philosophy, Economy, Law"
https://openalex.org/W2011994252,Public&amp;rsquo;s attitudes towards community pharmacy in Qatar: a pilot study,2011,4,-0.5,1,3,"Pharmacy, Medicine, Pharmacist, Community pharmacy, Public health, Family medicine, Community pharmacist, Alternative medicine, Nursing, Pathology"
https://openalex.org/W2159089445,Study exploring breast cancer screening practices amongst Arabic women living in the State of Qatar,2011,4,-0.5,1,3,"Breast cancer, Medicine, Arabic, Breast cancer screening, Cancer, Intervention (counseling), Incidence (geometry), Public health, Family medicine, Gynecology, Environmental health, Mammography, Nursing, Internal medicine, Philosophy, Linguistics, Physics, Optics"
https://openalex.org/W2134563707,Health problems of Nepalese migrants working in three Gulf countries,2011,6,0.3333333333333333,4,2,"Quarter (Canadian coin), Developing country, Public health, Environmental health, Work (physics), Health care, Medicine, Destinations, Socioeconomics, Occupational safety and health, Economic growth, Geography, Nursing, Tourism, Sociology, Economics, Mechanical engineering, Archaeology, Pathology, Engineering"
https://openalex.org/W2137586351,An inventory of diabetes care in Qatar,2011,1,-1.0,0,1,"Medicine, Multidisciplinary approach, Family medicine, Public health, Diabetes mellitus, Health care, National capital, Nursing, Economic growth, Business, Social science, Accounting, Sociology, Economics, National accounts, Endocrinology"
https://openalex.org/W2145868249,Health-related quality of life of Palestinian preschoolers in the Gaza Strip: a cross-sectional study,2011,1,-1.0,0,1,"Psychosocial, Medicine, Quality of life (healthcare), Cross-sectional study, Public health, Biostatistics, Mental health, Clinical psychology, Psychiatry, Gerontology, Environmental health, Nursing, Pathology"
https://openalex.org/W1969222425,"Epidemiology of scabies in the West Bank, Palestinian Territories (Occupied)",2011,2,1.0,2,0,"Scabies, Epidemiology, West bank, Christian ministry, Medicine, Palestine, Incidence (geometry), Population, Demography, Disease, Public health, Environmental health, Dermatology, Pathology, Ancient history, Philosophy, Physics, Theology, Sociology, Optics, History"
https://openalex.org/W2116416660,Health behaviour and health awareness in infant mortality in the Gaza Strip,2011,1,1.0,1,0,"Infant mortality, Breastfeeding, Medicine, Logistic regression, Child mortality, Health promotion, Demography, Pediatrics, Environmental health, Public health, Population, Nursing, Sociology, Internal medicine"
https://openalex.org/W2082071062,"Tobacco use, exposure to secondhand smoke, and cessation counseling among medical students: cross-country data from the Global Health Professions Student Survey (GHPSS), 2005-2008",2011,1,1.0,1,0,"Medicine, Biostatistics, Public health, Tobacco control, Environmental health, Smoking cessation, Secondhand smoke, Family medicine, Tobacco use, Cross-sectional study, Nursing, Population, Pathology"
https://openalex.org/W1892018522,"Tobacco Use, Exposure to Secondhand Smoke, and Cessation Counseling Training of Dental Students Around the World",2011,1,1.0,1,0,"Secondhand smoke, Tobacco control, Smoking cessation, Medicine, Environmental health, Family medicine, Tobacco use, Public health, Nursing, Population, Pathology"
https://openalex.org/W2115400118,The prevalence of waterpipe tobacco smoking among the general and specific populations: a systematic review,2011,17,-0.4117647058823529,5,12,"Medicine, Biostatistics, Context (archaeology), Population, Public health, Arabic, Environmental health, Epidemiology, Demography, Traditional medicine, Geography, Pathology, Linguistics, Philosophy, Archaeology, Sociology"
https://openalex.org/W2038401197,Predictors and outcomes of patient safety culture in hospitals,2011,7,-0.7142857142857143,1,6,"Patient safety, Safety culture, Medicine, Respondent, Health administration, Operationalization, Family medicine, Public health, Nursing, Health care, Philosophy, Management, Epistemology, Political science, Law, Economics, Economic growth"
https://openalex.org/W2086416910,"The rise in narghile (shisha, hookah) waterpipe tobacco smoking: A qualitative study of perceptions of smokers and non smokers",2011,7,-1.0,0,7,"Medicine, Focus group, Tobacco control, Biostatistics, Qualitative research, Psychological intervention, Environmental health, Public health, Residence, Demography, Nursing, Social science, Marketing, Sociology, Business"
https://openalex.org/W2055559696,"Occupational Violence at Lebanese Emergency Departments: Prevalence, Characteristics and Associated Factors",2011,2,-1.0,0,2,"Workplace violence, Verbal abuse, Occupational safety and health, Medicine, Job satisfaction, Occupational injury, Public health, Logistic regression, Emergency department, Burnout, Cross-sectional study, Injury prevention, Poison control, Environmental health, Nursing, Psychology, Clinical psychology, Social psychology, Pathology, Internal medicine"
https://openalex.org/W1584613316,High burden of rheumatic diseases in Lebanon: a COPCORD study,2011,1,-1.0,0,1,"Medicine, Fibromyalgia, Rheumatoid arthritis, Rheumatology, Prevalence, Rheumatism, Internal medicine, Epidemiology, Population, Physical therapy, Public health, Demography, Family medicine, Environmental health, Pathology, Sociology"
https://openalex.org/W2398045261,Public schools adolescents' obesity and growth curves in Lebanon.,2011,4,1.0,4,0,"Obesity, Overweight, Anthropometry, Socioeconomic status, Christian ministry, Medicine, Demography, Public health, Environmental health, Gerontology, Population, Political science, Endocrinology, Nursing, Sociology, Internal medicine, Law"
https://openalex.org/W2161563429,In search of a health education model: teachers’ conceptions in four Mediterranean countries,2011,1,1.0,1,0,"Curriculum, Health education, Health promotion, Sociocultural evolution, Social determinants of health, Health educators, Medical education, Psychology, Pedagogy, Medicine, Sociology, Public health, Nursing, Anthropology"
